{
  "$schema": "./figma-layout-spec.schema.json",
  "figmaFileKey": "PFt0LG6XmOiZWcSoUXIWIg",
  "nodeId": "15:247",
  "frameName": "murmur-dual-lfo-lab",
  "canonicalName": "murmur-dual-lfo-lab",
  "exportedAt": "2026-08-18",
  "exportSource": "figma-rest fetch",
  "size": { "width": 1280, "height": 720 },
  "insets": { "top": 16, "right": 16, "bottom": 16, "left": 16 },
  "sectionGap": 12,
  "codeOwners": {
    "shell": "DualLfoLabPanel",
    "header": "MurmurChromeBar",
    "workspace": "DualLfoLabPanel",
    "footer": "DualLfoLabPanel::paintBottomBar",
    "constants": "PlayModeLayout.h"
  },
  "children": [
    {
      "nodeId": "51:78",
      "name": "header-bar",
      "x": 16,
      "y": 16,
      "width": 1248,
      "height": 60,
      "codeMap": "MurmurChromeBar",
      "constant": "kDesignDualLfoLabHeaderHeight"
    },
    {
      "nodeId": "15:265",
      "name": "main-workspace",
      "x": 16,
      "y": 88,
      "width": 1248,
      "height": 548,
      "codeMap": "DualLfoLabPanel",
      "children": [
        {
          "nodeId": "15:266",
          "name": "lfo-column-01",
          "width": 419,
          "constant": "kDesignDualLfoColumnWidth"
        },
        {
          "nodeId": "15:352",
          "name": "lfo-column-02",
          "width": 419,
          "constant": "kDesignDualLfoColumnWidth"
        }
      ]
    },
    {
      "nodeId": "15:438",
      "name": "vst-bottom-bar",
      "x": 16,
      "y": 648,
      "width": 1248,
      "height": 56,
      "constant": "kDesignDualLfoBottomBarHeight",
      "codeMap": "DualLfoLabPanel::paintBottomBar"
    }
  ]
}
