{
  "$schema": "./figma-layout-spec.schema.json",
  "figmaFileKey": "PFt0LG6XmOiZWcSoUXIWIg",
  "nodeId": "37:787",
  "frameName": "murmur-design-engine",
  "canonicalName": "murmur-design-engine",
  "exportedAt": "2026-08-18",
  "exportSource": "figma-mcp get_metadata",
  "size": { "width": 1280, "height": 1048 },
  "insets": { "top": 16, "right": 16, "bottom": 16, "left": 16 },
  "sectionGap": 12,
  "codeOwners": {
    "shell": "MurmurRootEditor",
    "header": "MurmurChromeBar",
    "envelope": "MasterEnvelopePanel",
    "grid": "EngineGridPanel",
    "status": "VstBottomBar",
    "constants": "PlayModeLayout.h"
  },
  "children": [
    {
      "nodeId": "39:2",
      "name": "header-bar",
      "x": 16,
      "y": 16,
      "width": 1248,
      "height": 60,
      "codeMap": "MurmurChromeBar"
    },
    {
      "nodeId": "82:4",
      "name": "master-envelope-panel",
      "x": 16,
      "y": 88,
      "width": 1248,
      "height": 320,
      "constant": "kDesignModeV2MasterEnvelopePanelHeight",
      "codeMap": "MasterEnvelopePanel"
    },
    {
      "nodeId": "37:830",
      "name": "grid-section",
      "x": 16,
      "y": 420,
      "width": 1248,
      "height": 560,
      "constant": "kDesignModeV2GridSectionHeight",
      "codeMap": "EngineGridPanel",
      "children": [
        { "nodeId": "37:831", "name": "grid-row-1", "height": 270, "constant": "kDesignModeV2GridRowHeight" },
        { "nodeId": "37:1173", "name": "grid-row-2", "height": 270, "constant": "kDesignModeV2GridRowHeight" }
      ]
    },
    {
      "nodeId": "37:1507",
      "name": "status-bar",
      "x": 16,
      "y": 992,
      "width": 1248,
      "height": 40,
      "constant": "kDesignModeV2StatusBarHeight",
      "codeMap": "VstBottomBar"
    }
  ]
}
