{
  "$schema": "./figma-layout-spec.schema.json",
  "figmaFileKey": "PFt0LG6XmOiZWcSoUXIWIg",
  "nodeId": "36:4",
  "frameName": "murmur-play-view",
  "canonicalName": "murmur-desktop-play-mode",
  "exportedAt": "2026-08-18",
  "exportSource": "figma-mcp get_metadata",
  "size": { "width": 1280, "height": 720 },
  "insets": { "top": 20, "right": 20, "bottom": 12, "left": 20 },
  "sectionGap": 16,
  "codeOwners": {
    "shell": "MurmurRootEditor",
    "header": "MurmurChromeBar",
    "scope": "OscilloscopeView",
    "envelope": "MasterEnvelopePanel",
    "macros": "PatchFocusPanel",
    "footer": "VstBottomBar",
    "constants": "PlayModeLayout.h"
  },
  "children": [
    {
      "nodeId": "39:142",
      "name": "header-bar",
      "x": 20,
      "y": 20,
      "width": 1248,
      "height": 60,
      "codeMap": "MurmurChromeBar",
      "note": "Figma artboard 60px; kChromeBarHeightPlay = 44 in embed chrome"
    },
    {
      "nodeId": "36:35",
      "name": "oscilloscope",
      "x": 20,
      "y": 96,
      "width": 1240,
      "height": 130,
      "constant": "kDesktopPlayModeOscilloscopeHeight",
      "codeMap": "OscilloscopeView",
      "drift": { "cpp": 180, "reason": "JUCE flex layout allows scope to grow up to 180px on taller windows" }
    },
    {
      "nodeId": "82:83",
      "name": "master-envelope-section",
      "x": 20,
      "y": 242,
      "width": 1240,
      "height": 170,
      "constant": "kDesktopPlayModeMasterEnvelopePlayHeight",
      "codeMap": "MasterEnvelopePanel",
      "drift": { "cpp": 168, "reason": "Figma play envelope panel is 170px; cpp constant is 168 for compact row layout" }
    },
    {
      "nodeId": "36:155",
      "name": "performance-macros-deck",
      "x": 20,
      "y": 428,
      "width": 1240,
      "height": 208,
      "constant": "kDesktopPlayModePerformanceDeckHeight",
      "codeMap": "PatchFocusPanel",
      "padding": 24,
      "drift": { "cpp": 280, "reason": "JUCE flex layout allows macro deck up to 280px on taller windows" },
      "children": [
        { "nodeId": "36:156", "name": "macros-header", "height": 13, "constant": "kDesktopPlayModeMacrosHeaderHeight" },
        { "nodeId": "36:161", "name": "knobs-row", "height": 148, "constant": "kDesktopPlayModeKnobsRowHeight" }
      ]
    },
    {
      "nodeId": "36:226",
      "name": "vst-bottom-bar",
      "x": 20,
      "y": 652,
      "width": 1240,
      "height": 56,
      "constant": "kDesktopPlayModeBottomBarHeight",
      "codeMap": "VstBottomBar",
      "drift": { "cpp": 64, "reason": "Figma bottom bar is 56px; cpp reserves 64px for stage-action row" }
    }
  ]
}
